<?xml version="1.0" encoding="UTF-8"?>
<!--
    Document    : ElectionSurvey_schema.xsd
    Author      : vincent
    Description :
        This xml document collects event details for event management.
-->

<EventManager xmlns="http://www.creatinemanagement.com"
              xmlns:xsi="http://www.w3.org/2001/XMLSchema-instance"
              xsi:schemaLocation="http://www.creatinemanagement.com EventManagement_schema.xsd">
    <Event orderid="A556">
        <Customer>TideWaterHouseCoopers</Customer>
        <Venue>Hilton Bermingham Metropole</Venue>
        <Date>2007-04-24</Date>
        <NoOfGuests>500</NoOfGuests>
        <ContactNumber>3453667</ContactNumber>
        <Address>32 High Street, North Midlands</Address>
    </Event>
    <Service category="Annual Conderence">
        <TechDelivery>Multimedia Arrangement</TechDelivery>
        <Entertainment>Media Personality</Entertainment>
        <VenueBooking>Through TravelDesignated Service</VenueBooking>
        <Theming>Emulate Movie Themed Dinner</Theming>
    </Service>
</EventManager>